<?xml version="1.0" encoding="UTF-8"?>
<!DOCTYPE carta SYSTEM "carta.dtd">
<carta nombre='El platano canario'>
    <informacion>
        <nombre>&nombreLocal;</nombre>
        <ubicacion>Icod de los Vinos, Tenerife</ubicacion>
    </informacion>
    <seccion tipo='entrantes'>
        <titulo>Para compartir</titulo>
        <plato id='P01' alergenos='gluten' vegano='FALSE'>
            <nombre>Queso asado</nombre>
            <descripcion>Queso canario con mojo rojo y verde</descripcion>
            <precio moneda='EUR'>8.00</precio>
            <recomendacion plato='P01' />
        </plato>
        <plato id='P02' alergenos='gluten' vegano='TRUE'>
            <nombre>Papas arrugadas</nombre>
            <descripcion>Papas con mojo</descripcion>
            <precio moneda='EUR'>4.00</precio>
        </plato>
    </seccion>
    <!--Postres de la carta-->
    <seccion tipo='postres'>
        <titulo>Para disfrutar</titulo>
        <plato id='P03' frio='TRUE' recomendado='TRUE'>
            <nombre>Brownie</nombre>
            <descripcion>Brownie de chocolate con nueces</descripcion>
            <precio moneda='EUR'>2.00</precio>
        </plato>
        <plato id='P04' frio='FALSE'>
            <nombre>Helado de vainilla</nombre>
            <descripcion>Bola de helado de vainilla con sirope a elegir entre chocolate, caramelo o fresa</descripcion>
            <precio moneda='EUR'>8.00</precio>
        </plato>
    </seccion>
</carta>